{"actual_model_id":"claude-opus-4-8","call_receipt":"Agent task ac18f12cb61a373e1 output transcript (harness-tracked)","config_digest":{"evidence_ref":"Agent tool invocation, model=fable explicit","unavailable_reason":"子代理无独立配置文件","value":"UNAVAILABLE"},"exit_status":0,"findings_summary":["[INFO] ","[INFO] ","[INFO] "],"input_commit":"11b71e9bed9078c2483dc27ae94a807689ff5528","input_manifest_digest":"e118930818cdbcbf7e50e19cad98ca7e8faaa0207d23b65557f31e4ccaf16679","model_version":{"evidence_ref":"SESSION_IDENTITY.M1.v1.json environment_observations","unavailable_reason":"Claude Code 子代理不暴露内部模型修订号","value":"UNAVAILABLE"},"output_report_digest":"d2230d43d4b221cd6743d13dd3181b18c837ef42a167a95a5dfe29510c3546bc","prompt_digest":"f0d9753f2dc19b6948e2a51854b2a2f8bc8f49d30b579c600fbe2a0464e7b7f3","provider":"anthropic","receipt_digest":"54034a14bb8c40dd6f4137ee8e8092551c0469612ee4cdb3cac2477791c1ac64","reviewer_kind":"INDEPENDENT_CLAUDE_FABLE_ADVERSARIAL_REVIEWER","schema_version":"p7-signer-receipt-v1","session_isolation_attestation":{"auto_memory_disabled_or_not_applicable":true,"did_not_author_reviewed_scope":true,"fresh_session_not_fork_not_resume":true,"isolation_evidence":"全新非 fork/非 resume 会话；未参与 M1 实现；一切结论从磁盘独立复算（三 manifest 摘要、合同集摘要、快照三方一致、检查器/测试/扫描实跑）；所有实验写在 $TMPDIR 合成根/副本，仓库零写——会话末 git status 与起始逐字相同（仅作者预置的 AGENT_LEDGER_ADDENDUM / VERIFICATION_RECEIPTS.v2/v3 / milestones/ 未跟踪项），无我引入的任何跟踪/未跟踪改动，无 git 写动作；加载的自动记忆为 diyu 项目通用画像，与本审查范围无著作关系，隔离不受影响。"},"signed_at":"2026-07-16T19:19:14.325346+00:00","task_thread_session_id":"ac18f12cb61a373e1","tool_summary":"read-only: Read/Grep/Glob/Bash(只读命令+/tmp 副本实验), 零仓写入","verdict":"ACCEPT"}